{
    "categoryName": "All Bellways",
    "splitIds": [
        "StartNewGame",
        "MossMotherTrans",
        "SilkSpearTrans",
        "MarrowBell",
        "-SavedFleaDeepDocksSprint",
        "SwiftStepTrans",
        "-DeepDocksStation",
        "-SavedFleaDeepDocksBellway",
        "Lace1Trans",
        "-SavedFleaFarFieldsTrap",
        "DriftersCloakTrans",
        "-FarFieldsStation",
        "-SavedFleaHuntersMarch",
        "-SavedFleaMarrow",
        "-CaravanTroupeGreymoor",
        "-BellhartStation",
        "EnterShellwood",
        "-ShellwoodStation",
        "ClingGripTrans",
        "-Widow",
        "BellhartBell",
        "-GreymoorStation",
        "-EnterSinnersRoad",
        "-EnterBilewater",
        "BilewaterStation",
        "-EnterMist",
        "LeaveMist",
        "-Phantom",
        "-GrandBellwayStation",
        "Act2Started",
        "SlabStation",
        "-EnterMemorium",
        "-EnterPutrifiedDucts",
        "PutrifiedDuctsStation",
        "BlastedStepsStation"
    ],
    "gameName": "Hollow Knight: Silksong Category Extensions",
    "variables": {
        "All Bellways Subcategory": "No Major Glitches"
    }
}
