{
    "categoryName": "5 Tools",
    "splitIds": [
        "StartNewGame",
        "EnterBoneBottom",
        "SwiftStepTrans",
        "WardingBell",
        "Flintslate",
        "FracturedMask",
        "Compass"
    ],
    "gameName": "Hollow Knight: Silksong Category Extensions",
    "variables": {
        "5 Tools Subcategory": "All Glitches"
    },
    "pauseOnFileSelect": false
}
