{
    "categoryName": "Beer Bottle%",
    "splitIds": [
        "StartNewGame",
        "MossMother",
        "SilkSpear",
        "BellBeastTrans",
        "SwiftStep",
        "SavedFleaDeepDocksSprint",
        "SavedFleaDeepDocksBellway",
        "SavedFleaHuntersMarch",
        "BoneBottomSimpleKey",
        "SavedFleaWormways",
        "SavedFleaMarrow",
        "EnterBellhart",
        "Lace1"
    ],
    "gameName": "Hollow Knight: Silksong",
    "variables": {
        "Beer Bottle% Subcategory": "No Major Glitches"
    }
}
