{
    "categoryName": "2 Spool Fragments",
    "splitIds": [
        "StartNewGame",
        "MossMotherTrans",
        "SilkSpearTrans",
        "SpoolFragment1",
        "MarrowBell",
        "Spool1"
    ],
    "gameName": "Hollow Knight: Silksong Category Extensions",
    "variables": {
        "2 Spool Fragments Subcategory": "No Major Glitches"
    }
}
