{
    "categoryName": "Bath%",
    "splitIds": [
        "StartNewGame",
        "EnterBoneBottom",
        "SwiftStepTrans",
        "EnterBlastedSteps",
        "MaggotsRemoved"
    ],
    "gameName": "Hollow Knight: Silksong Category Extensions",
    "variables": {
        "Bath% Subcategory": "All Glitches"
    },
    "pauseOnFileSelect": false
}
